<?xml version="1.0" encoding="UTF-8"?>
<list xmlns:xsi="http://www.w3.org/2001/XMLSchema-instance" xsi:noNamespaceSchemaLocation="../../xsd/items.xsd">
	<item id="40200" name="沙哈斗篷" type="Armor">
		<table name="#Plus">重力拳鬥士</table>
		<table name="#Desc">繼承沙哈之力的人所裝備的斗篷。魔法防禦力+40</table>
		<set name="icon" val="icon.vesper_cloack_i00" />
		<set name="default_action" val="EQUIP" />
		<set name="bodypart" val="back" />
		<set name="crystal_type" val="R" />
		<set name="material" val="CLOTH" />
		<set name="weight" val="220" />
		<for>
			<add order="0x10" stat="mDef" val="40" />
			<add order="0x10" stat="pDef" val="50" />
		</for>
	</item>
	<item id="40201" name="沙哈斗篷" type="Armor">
		<table name="#Plus">沙哈預知者</table>
		<table name="#Desc">繼承沙哈之力的人所裝備的斗篷。魔法防禦力+40</table>
		<set name="icon" val="icon.vesper_cloack_i00" />
		<set name="default_action" val="EQUIP" />
		<set name="bodypart" val="back" />
		<set name="crystal_type" val="R" />
		<set name="material" val="CLOTH" />
		<set name="weight" val="220" />
		<for>
			<add order="0x10" stat="mDef" val="40" />
			<add order="0x10" stat="pDef" val="50" />
		</for>
	</item>
</list>