<?xml version="1.0" encoding="UTF-8"?>
<list xmlns:xsi="http://www.w3.org/2001/XMLSchema-instance" xsi:noNamespaceSchemaLocation="../../xsd/items.xsd">
	<item id="23347" name="武器用強化輔助石-R級" type="EtcItem">
		<table name="#Desc">維他命道具：強化R級武器時，可將機率提升10%的道具。僅限使用於強化3~9的道具。可以交易、丟棄或刪除的道具，也可以保管在個人倉庫。</table>
		<set name="icon" val="icon.ench_wp_potion_violet_i00" />
		<set name="etcitem_type" val="SCRL_INC_ENCHANT_PROP_WP" />
		<set name="material" val="PAPER" />
		<set name="weight" val="120" />
		<set name="is_tradable" val="false" />
		<set name="is_dropable" val="false" />
		<set name="is_sellable" val="false" />
		<set name="is_stackable" val="true" />
		<set name="is_premium" val="true" />
		<set name="handler" val="ItemSkills" />
		<set name="item_skill" val="9207-1" />
	</item>
	<item id="23348" name="防具用強化輔助石-R級" type="EtcItem">
		<table name="#Desc">維他命道具：強化R級防具時，可將機率提升15%的道具。僅限使用於強化3~9的道具；而連身防具則僅限使用於強化4~9的道具。可以交易、丟棄或刪除的道具，也可以保管在個人倉庫。</table>
		<set name="icon" val="icon.ench_am_potion_violet_i00" />
		<set name="etcitem_type" val="SCRL_INC_ENCHANT_PROP_AM" />
		<set name="material" val="PAPER" />
		<set name="weight" val="120" />
		<set name="is_tradable" val="false" />
		<set name="is_dropable" val="false" />
		<set name="is_sellable" val="false" />
		<set name="is_stackable" val="true" />
		<set name="is_premium" val="true" />
		<set name="handler" val="ItemSkills" />
		<set name="item_skill" val="9208-1" />
	</item>
</list>